1624,TBill Purchased was booked twice on the system for the CBN Retiree Fund (Ref:03011602),ARM Pensions›Investment Mangement›Investment Mangement,1/19/2016 10:41,2/29/2016 13:27,1/7/2016,1/8/2016,₦0.00,,No loss recorded,0,0,0,Closed,Omokolade Amu,"Execution, Delivery and Process Management›Transaction capture, execution and maintenance›Transaction not booked or Transaction not registered as and when due",Omokolade Amu,People›Skills›Negligence of duties and responsibilities,,,,,Overstatement of the Fund's asset under management,,,,,,,,,Create Excel Template for recording transactions to enhance end of day reconciliation | Remove the duplicated trade| Commence second level review of bookings based on the approved investment recommendation before approving trades on Fundware,Omokolade Amu| Omokolade Amu| Omokolade Amu,2016-01-28| 2016-01-08| 2016-01-28,Completed| Completed,Complete| Complete| Complete,,,,
1625,Erroneous booking omission of an investment liquidation for TCF Fund (Ref:03011602),ARM Pensions›Investment Mangement›Investment Mangement,1/19/2016 10:47,3/2/2016 9:56,1/8/2016,1/11/2016,₦0.00,,No loss was recorded,0,0,0,Closed,Omokolade Amu,"Execution, Delivery and Process Management›Transaction capture, execution and maintenance›Transaction not booked or Transaction not registered as and when due",Omokolade Amu,People›Skills›Negligence of duties and responsibilities,,,,,Misstatement of Asset Allocation of the affected Fund,Actual Loss,,,There is no financial loss,,,,,Create Excel Template for recording transactions to enhance end of day reconciliation| Book omitted transaction| Commence second level review of bookings based on the approved investment recommendation before approving trades on Fundware,Emeka Okolo| Omokolade Amu| Emeka Okolo,2016-01-28| 2016-01-11| 2016-02-29,Completed| Completed,Complete| Complete| Complete,,,,
1626,Liquidation was not treated for the RSA Retiree Fund due to system issues in FCMB (Ref: 03011602),ARM Pensions›Investment Mangement›Investment Mangement,1/19/2016 10:50,1/27/2016 12:41,1/11/2016,1/12/2016,₦0.00,,No loss was recorded,0,0,0,Closed,Omokolade Amu,Business Disruption and System Failures›Inadequacy / Inefficiency / Malfunction or Block of Technology Systems or Company infrastructure›System downtime,Omokolade Amu,External Events›Client / Customer Relations›Inadequate/inappropriate information provided by the client,,,,,Possible limited access to  finance a planned to finance other  investment,Potential Loss,Loss or Damage to Assets,,there was no financial loss,,,,,Obtain documented reason for the delay| Book the liquidation appropriately based on the information from the counter parties ,Omokolade Amu| Omokolade Amu,2016-01-12| 2016-01-12,Completed| Completed,Complete| Complete,,,,
1631,Power Surge and damage to NAV test server power pack.,ARM Pensions›Information Technology›Information Technology,1/26/2016 6:42,1/27/2016 12:50,1/25/2016,1/25/2016,₦0.00,,server not in production environment,0,0,0,Closed,Eromonse Ohizua,Disasters and Other Events›Accidents and public safety›Electrical surges,Abiodun Oke,"External Events›Social and Natural Environment›Natural disasters (Fire, floods, etc)",,,,,Test environment was not available for users to connect to.,Actual Loss,Reduced operational capacity,,There was no financial loss,,,,,Obtain a power pack with similar ratings from a decommissioned system to replace the faulty one on NAV test.,Abiodun Oke,1/25/2016,,Complete,,,,
1641,Fraudulent intent on a client's account (PEN100385041024),ARM Pensions›Customer Experience›Customer Service,2/10/2016 8:27,8/8/2016 12:16,1/11/2016,1/11/2016,"₦36,978.23",0,25% of the balance of on the account.,0,0,0,Closed,Lawrence Sonibare,External Fraud›Unauthorised Activities (External)›Account take over / impersonation,Asikiya Macs-Omieye,Process›Adequacy of Procedures›Non adherence to processes and procedures,People›Skills›Negligence of duties and responsibilities,,,,Potential Financial loss arising from paying a wrong beneficiary to an account which can effectively lead to double payment of benefit,Potential Loss,Restitution,0,The fraudualent payment was discovered during the payment review,,,,,Organised a team to represent the ARMP at the Office of the Public Defender to explain the circumstance leading to the issue at hand and the firm's position presenting all relevant relating the attempt impersonation,Ayodeji Majaro,3/31/2016,,Complete,,,,
1642,Erroneous Transfer of Annuity premium for client (PEN200102228493) to a different Insurance Company (ARMLIFE),ARM Pensions›Operations›Benefit Administration,2/12/2016 13:05,2/29/2016 14:23,12/16/2015,2/10/2016,₦0.00,0.00| 0.00,the transfer was to a Corporate account which has been recalled successfully.,0,0,0,Closed,Shola Akinola,"Execution, Delivery and Process Management›Transaction capture, execution and maintenance›Erroneous payment to a client, vendor or other counterpaties",Enemaku Aduku,People›Skills›Negligence of duties and responsibilities,,,,,Client dissatisfaction as the client mandate was not effectively and correctly carried out.| Delay in retracting the erroneous payment and reprocessing it correctly,Actual Loss| Actual Loss,Reputational Loss| Restitution,0.00| 0.00,,,,,,Contact the insurance company (ARM Life) for refund of erroneous payment and reprocessed correctly | Compliance to commence attaching RSA statement during their review stage to all payment involving emptying clients account before sending the instruction to custodian for payment,Enemaku Aduku| Kofo Ejueyitchie,2016-02-16| 2016-02-29,,Complete| Complete,,,,
1644,Missing Batch of Clients’ DOB Update Request Documents,ARM Pensions›Operations›Data Management Unit,2/12/2016 19:12,1/26/2017 8:47,2/12/2016,2/12/2016,₦0.00,0.00| 0.00,0,0,0,0,Closed,Elizabeth Williams,"Clients, Products and Business Practices›Mismanagement of classified company information›Misplacement of client information and correspondence",Lawrence Sonibare,Process›Adequacy of Procedures›Lack of formal procedures / guidelines,People›Skills›Negligence of duties and responsibilities,,ARM Pensions›Administration,Administration›Incoming Mail Administration,High level of client dissatisfaction due lost of confidential documents | Delay in processing client request (required DOB update) as new document will have to be obtained,Potential Loss| Potential Loss,Reputational Loss| Loss or Damage to Assets,0.00| 0.00,Loss could not be quantified| Loss could not be quantified,,,,,Reprocess the update request using the photocopies of the misplaced documents| Institute a mail tracking system/ process/ Procedure on  Exchange of Information with respect on Outgoing and Inward post in accordance with the ISO 27001| Develop and strictly implement a company wide Exchange of Information Policy with respect inward and outgoing post in accordance with ISO27001 Standard  ,Lawrence Sonibare| Esther Ukwuoma| Esther Ukwuoma,2016-02-29| 2016-09-30| 2016-11-30,"Photocopies/printed copies have been obtained to process the update with PENCOM. However, this is against PENCOM requirement so we await PENCOM feedback| To be approved as part of the ISO 27001 documentation process| To be approved as part of the ISO 27001 documentation process ",Complete| Complete| Complete,,,,
1646,Network Printer Downtime within the Benefit and Contribution Processing Units,ARM Pensions›Administration›Administration,2/16/2016 9:15,5/26/2017 18:25,2/15/2016,2/15/2016,₦0.00,0.00| 0.00| 0.00,"Loss could not be quantified. However, there has been loss of productive man hours",0,0,0,Closed,Ayodeji Majaro,Business Disruption and System Failures›Inadequacy / Inefficiency / Malfunction or Block of Technology Systems or Company infrastructure›System downtime,Esther Ukwuoma,"External Events›Outsourcing›Lack of formalization of relationship with outsourcer (duties, deliverables etc)",,,,,"Increased level dissatisfaction as client request were not promptly addressed as at when due| Increased level dissatisfaction as client request were not promptly addressed as at when due| Loss of productive man power, the contribution processing unit were not able to work due to inability to print out required schedules",Potential Loss| Potential Loss| Potential Loss,Regulatory Action| Reduced operational capacity| Reduced operational capacity,0.00| 0.00| 0.00,Loss can not be quantified| Loss can not be quantified| Loss can not be quantified,,,,,Invite the vendor to rectify and service the printers for optimal functionality | Follow up with the Vendor and Complaince to review and where necessary update and sign the SLA with the vendor especially the level of support to be provided| Have in a place a regular back up printer for emergency purpose.,Esther Ukwuoma| Esther Ukwuoma| Esther Ukwuoma,2016-02-16| 2017-02-03| 2016-02-29,SLA under review to suit ARM Pensions’ purpose,Complete| Complete| Complete,,,,
1651,Applying a wrong retirement date to 3 processed benefit application leading to the rejection of such application by the PENCOM,ARM Pensions›Operations›Benefit Administration,2/17/2016 11:49,4/18/2016 13:09,2/9/2016,2/15/2016,₦0.00,0.00| 0.00,There is no financial loss,0,0,0,Closed,Oluwaseun Adewale,"Execution, Delivery and Process Management›Transaction capture, execution and maintenance›Data entry errors (e.g. wrong payment instructions, wrong account credited etc.)",Ayodeji Majaro,Systems›System availability›Software failure (Software / data corruption etc),People›Skills›Negligence of duties and responsibilities,,X_Operations›Information Technology›Information Technology,,Potential warning letter and regulatory fine due to increased rate of returned application by PenCom| Reputational damage as the firm's request will continue to get scrutinized due to the firm's impaired integrity issue emanating from increased error rate.,Potential Loss| Potential Loss,Regulatory Action| Reputational Loss,0.00| 0.00,This is still a potential regulation action| This loss cannot be quantified.,,,,,"Follow up with IT to engage the Navision Vendor to prevent users from using the future dates especially when processing benefit application.| Follow up with IT to also Engage Navision Vendor to disable the use of DOB (Date of birth) as a default retirement date. When applicant exit date is not provided, retirement date should be blank be default| Benefit Admin should reprocess the enbloc benefit application using the correct retirement date and Navision properly corrected",Enemaku Aduku| Enemaku Aduku| Enemaku Aduku,2016-02-29| 2016-02-29| 2016-02-29,,Complete| Complete| Complete,,,,
1654,"ADMIN FEES CHARGED ON AVC -  PEN100080922193, PEN100488409019, PEN100118599637",ARM Pensions›Operations›Contributions Processing,2/22/2016 12:28,2/29/2016 11:32,9/18/2009,2/18/2016,₦0.00,0,None compliance with the AVC guidelines.,0,0,0,Closed,Ayodeji Majaro,"Execution, Delivery and Process Management›Transaction capture, execution and maintenance›Application of wrong interest, exchange, other  rates",Ayodeji Majaro,People›Capacity›Staff shortages within support units (lack of capacity in supporting units),Systems›System Adequacy›System inadequate for nature of required tasks,,,,Potential regulatory fine due to none compliance with the AVC guidelines,Potential Loss,Regulatory Action,0,,,,,,"These contributions are all Pre-Navision, and as such cannot be reversed and reprocess. Payment are to be made based on the current AVC balance.",,,,Complete,,,,
1655,Erroneous inclusion of AVC balance while computing Lumpsum payment for client PEN200000153915,ARM Pensions›Operations›Benefit Administration,2/22/2016 14:24,5/30/2016 10:59,2/9/2016,2/16/2016,₦0.00,0.00| 0.00,No loss,0,0,0,Closed,Kofo Ejueyitchie,"Execution, Delivery and Process Management›Transaction capture, execution and maintenance›Data entry errors (e.g. wrong payment instructions, wrong account credited etc.)",Ayodeji Majaro,People›Skills›Negligence of duties and responsibilities,,,,,Potential finanacial loss due to overstatement of amount due to client | Increased error in approval request sent to Pencom can instigate warning letter and possibly fine   ,Potential Loss| Potential Loss,Restitution| Reputational Loss,0.00| 0.00,,,,,,Reprocessed the Lumpsum payment based on the current RSA balance.| Liaise with IT to create a report that will separate AVC balance from total RSA contribution at every point in time| Process AVC payment based on the PenCom Approval,Ayodeji Majaro| Ayodeji Majaro| Ayodeji Majaro,2016-03-10| 2016-03-11| 2016-03-10,,Complete| Complete| Complete,,,,
1660,Inability to Access Abuja Benefit  Administration Folder on the Shared Drive(T-Drive) Due to Virus Attack,ARM Pensions›Operations›Benefit Administration,2/24/2016 10:16,8/24/2016 16:14,2/18/2016,2/18/2016,₦0.00,0.00| 0.00,cannot be quantified,0,0,0,Closed,Enemaku Aduku,External Fraud›System Security (External)›Malicious Virus attack - External,Ayodeji Majaro,Systems›Data Protection›Virus / Intrusion attacks,,,,,Loss of productive man hours due inability to timely access required documment| Loss of vital documents as the recovery process was not upto date,Actual Loss| Potential Loss,Reduced operational capacity| Loss or Damage to Assets,0.00| 0.00,,,,,,"Follow up with It to get the issue resolved and full access received for the shared drive | Obtained Incidence report from IT stating the root cause of the event, effect and vendor's resolution| Review back up process we currently have in Abuja and commence weekly back up on an hard drive.| Transfer all recovered Benefits Files to the shared drive.",Ayodeji Majaro| Ayodeji Majaro| Steve Omali| Steve Omali,2016-03-01| 2016-03-01| 2016-04-29| 2016-02-22,"1.IT was able to mitigate more damages by disconnecting source system from the network and initiating system scan for such viruses.

2.IT is currently working on engaging security experts on how to access the corrupted files and forestall further attacks as such.

3.All systems were updated with the newer ePO Agent and test communication has been carried out between the Agent and the ePO Server and confirmed that all systems are communicating accordingly.

4.Ran a VSE targeted Scan on systems for specific directories and registry which Ransomware-Locky usually copies itself into.| Done",Complete| Complete| Complete| Complete,,,,
1661,"Erroneous Lumpsum Payment to 3 Clients (PEN100015137213, PEN100116436414 and PEN200005806002 )",ARM Pensions›Operations›Benefit Administration,2/24/2016 11:38,2/29/2016 10:30,11/12/2015,2/19/2016,"₦1,001.10","192,001.10","The client was to be paid N3,002,365.32, but the client was paid N3,194,324.09 instead . An excess of N191,958.77 was paid in error. The client refunded N191,000 but due to a price different after posting, the account is in negative of N-3.31. Two additional similar errors was discovered","191,955.47","192,001.10",45.63,Closed,Kofo Ejueyitchie,"Execution, Delivery and Process Management›Transaction capture, execution and maintenance›Erroneous payment to a client, vendor or other counterpaties",Ayodeji Majaro,People›Skills›Negligence of duties and responsibilities,,,,,Financial loss due to overpaid benefit,Actual Loss,Restitution,"192,001.10",Being the overpaid amount,,,,,Commence refund processing by contacting the client to refund over paid amount| Compliance to commence attaching RSA statement during their review stage to all payment involving emptying clients account before sending the instruction to custodian for payment,Ayodeji Majaro| Kofo Ejueyitchie,2016-02-22| 2016-02-29,"The client refunded 191000 as suppose 191,958.77.",Complete| Complete,2016-02-22| 2016-02-22,"191,000.00| 955.47",Others| Others,Refund from the client| Price movement Adjustment
1663,Inability to Authorise Processed Contributions on Ms-Navision from Friday 26/02/2016 Till Date,ARM Pensions›Operations›Contributions Processing,2/29/2016 7:57,4/18/2016 12:46,2/26/2016,2/26/2016,₦0.00,0.00| 0.00| 0.00| 0.00,NA,0,0,0,Closed,Martins Edesemhen,Business Disruption and System Failures›Inadequacy / Inefficiency / Malfunction or Block of Technology Systems or Company infrastructure›Automated data processing errors,Martins Edesemhen,External Events›Outsourcing›Performance failure of outsourced vendor / service provider,,,ARM Pensions›Information Technology›Information Technology,,"Inability to process contributions to clients respective accounts for February 25 and 26, 2016| Inability to notified client of received contributions as SMS alert is being delayed till when contribution is finalized| Financial loss as the processed contribution for the affected dates were not invested| Increased backlog of activities for the authorizer increased the tendency for human error ",Actual Loss| Actual Loss| Actual Loss| Potential Loss,Loss or Damage to Assets| Reputational Loss| Loss or Damage to Assets| Reduced operational capacity,0.00| 0.00| 0.00| 0.00,,,,,,"Follow up IT to contact the Vendor and get the issue resolved and ensure smooth operational activity| Obtained Incidence report from IT stating the root cause of the event, effect and vendor resolution  ",Martins Edesemhen| Oluwaseun Adewale,2016-03-01| 2016-03-04,,Complete| Complete,,,,
1667,Attempted Burglary of Store Items in Abuja ARMP's Office,ARM Pensions›X_Human Resources and Administration›Human Resources and Administration,3/7/2016 15:15,8/8/2016 13:46,2/28/2016,2/28/2016,₦0.00,0.00| 0.00,Items stolen were all recovered,0,0,0,Closed,Vera Elemi,"External Fraud›Theft and Fraud (External)›Theft of company assets (e.g. Pool car theft, Petty cash theft, etc.)",Esther Ukwuoma,People›Motivation›Corruption / Criminal intent,,,,,Destruction/damage to company property | Inreased vulnerability of properties and other assets within the office premisses,Actual Loss| Potential Loss,Loss or Damage to Assets| Loss or Damage to Assets,0.00| 0.00,Could not be ascertain at the moment,,,,,The security guards as a matter of urgency should be changed(including changing the vendor if possible)| Install burglary proofs on all the windows so as to forestall further occurrences| Installation of CCTV camera on the company premises,Esther Ukwuoma| Esther Ukwuoma| Esther Ukwuoma,2016-03-31| 2016-03-31| 2016-03-31,The security guard in charged was changed but the vendor is still in use at the location,Complete| Complete| Complete,,,,
1670,PIN SWAP ON NAVISION (PEN100456265916 & PEN200481114817),ARM Pensions›Operations›Data Management Unit,3/17/2016 12:20,4/12/2016 16:32,3/17/2016,3/17/2016,₦0.00,0,NIL,0,0,0,Closed,Bolatito Odusanya,"Execution, Delivery and Process Management›Customer intake and documentation›Improper account setup",Lawrence Sonibare,Systems›System Security›Inadequate security over critical data areas,Process›Adequacy of Procedures›Non adherence to processes and procedures,People›Capacity›Staff shortages within unit (lack of capacity in unit),ARM Life›Information Technology,PMO›Project Execution,Potential erroneous crediting of RSA contribution,Near Miss,,0,Account are unfunded,,ARM Pensions›Operations›Data Management Unit,,,"Send ID for the newly created record to IT to update pin.

| Create the missing record on Navision| Update the details of rightful owner of pin PEN100456265916 on Navision| Send the newly update pin to RM to confirm if the pin/record is on unprocessed monies",Lawrence Sonibare| Lawrence Sonibare| Lawrence Sonibare| Lawrence Sonibare,2016-03-23| 2016-03-23| 2016-03-23| 2016-03-23,"The details of the pin- PEN100456265916 has been updated
The record of missing pin has been created on Navision",Complete| Complete| Complete| Complete,,,,
1672,Delay by GTBank in liquidating Fund's Placement (NERC),ARM Pensions›Investment Mangement›Investment Mangement,4/5/2016 9:18,5/6/2016 11:02,4/4/2016,4/5/2016,₦0.00,0,Booking error,0,0,0,Closed,Omokolade Amu,"Execution, Delivery and Process Management›Transaction capture, execution and maintenance›Transaction not booked or Transaction not registered as and when due",Omokolade Amu,External Events›Outsourcing›Performance failure of outsourced vendor / service provider,,,,,Potential delay in meeting fund sponsor's cash request.,Potential Loss,Reputational Loss,0,,,,,,Request for a formal reason for the delay| Request for interest income due for each day of the delay as an added accrued income.,Omokolade Amu| Omokolade Amu,2016-04-14| 2016-04-14,,Complete| Complete,,,,
1674,Passport Swap (BTW Two RSA Forms With Same PIN -PEN100270340433 But Different Biometrics),ARM Pensions›Administration›Administration,4/11/2016 12:14,5/6/2016 12:38,4/11/2016,4/11/2016,₦0.00,0.00| 0.00,0,0,0,0,Closed,Bolatito Odusanya,"Execution, Delivery and Process Management›Transaction capture, execution and maintenance›Data entry errors (e.g. wrong payment instructions, wrong account credited etc.)",Lawrence Sonibare,Systems›System Adequacy›System inadequate for nature of required tasks,Process›Change Management›Lack of documented guidelines for new processes / services developed,,,,Bio-metrics swap between record could undermine the integrity of database record.| Pin Swap could lead to wrong account being credited.,Actual Loss| Potential Loss,,0.00| 0.00,0,Operations,ARM Pensions,,,Determine the rightful owner of pin (PEN100270340433) using available text information on RSA form that is PenCom data from CRAS and upload biometrics accordingly.,Lawrence Sonibare,4/18/2016,Action at review stage.,Complete,,,,
1676,Navision Application Downtime Between 8.10am and 11.50am,ARM Pensions›Information Technology›Information Technology,4/12/2016 8:51,5/8/2016 15:34,4/12/2016,4/12/2016,₦0.00,0,Loss could not be estimated,0,0,0,Closed,Ahmed Shittu,Business Disruption and System Failures›Inadequacy / Inefficiency / Malfunction or Block of Technology Systems or Company infrastructure›Automated data processing errors,Abiodun Oke,Systems›System availability›Hardware failure (Failure of wearing parts etc),,,,,Ability to use mobile application| Users could not access NAV application during the outage period.| External Clients were unable to access the client portal during the outage period.,Actual Loss| Actual Loss| Actual Loss,Reduced operational capacity| Reduced operational capacity| Reduced operational capacity,0,,,,,,As contained the in attached incident report.,Abiodun Oke,4/15/2016,,Complete,,,,
1677,Breach of Data Confidentiality for Personal Monetary Gains,ARM Pensions›Operations›Benefit Administration,4/12/2016 17:23,8/8/2016 14:01,3/3/2016,3/3/2016,₦0.00,0,Loss amount could not be estimated,0,0,0,Closed,Oluwaseun Adewale,Internal Fraud›Theft and Fraud (Internal)›Bribes/Kickbacks,Layi Afolabi,People›Motivation›Corruption / Criminal intent,Systems›System Security›Inadequate security over critical data areas,,,,Loss of FUM and the resultant management fee.,Actual Loss,Loss or Damage to Assets,0,Unable to the estimate loss,,,,,"Encryption of certain confidential information about Clients btw PFCs and ARM Pensions.

Have a more rubout log in process

Internal audit to have free access to audit trail of staff to client financial information

Awareness on data security| IT to set up audit trails to monitor all user access to client information| Review and Upgrade of organizations Data Loss Policy Systems (E.g Installation of McAfee Complete Data Protection Advance Suites)| Re-organisation of Benefit Admin Unit including the Unit heads and aggressively recruit new staff to join the unit.",Abiodun Oke| Abiodun Oke| Abiodun Oke| Akinola Akinwole,2016-04-29| 2016-04-29| 2016-05-31| 2016-06-30,Major changes are currently ongoing and new staff are currently being added,Complete| Complete| Complete| Complete| Complete,,,,
1678,Inability to Book Trades on 12-04-16 Due to Fundware malfunctioning,ARM Pensions›Investment Mangement›Investment Mangement,4/13/2016 10:28,8/9/2016 10:47,4/12/2016,4/12/2016,₦0.00,0.00| 0.00,Inability to book and not transaction related,0,0,0,Closed,Omokolade Amu,"Business Disruption and System Failures›Interruption in services provided by external providers›Inability to process transactions on external applications (CSCS website, NSE trading terminal, etc.)",Omokolade Amu,Systems›System availability›Software failure (Software / data corruption etc),,,,,Inaccurate the daily valuation report and assets allocation due to the inability to book trade a whole day| There is a risk of not posting trades to relevant periods they occur due to human error in mismatching transaction date,Actual Loss| Potential Loss,Reduced operational capacity,0.00| 0.00,,,,,,Follow up with Milesoft to resolve the system glitch relating to equity booking.| Book omitted trades ,Omokolade Amu| Omokolade Amu,2016-04-29| 2016-04-29,,Complete| Complete,,,,
1679,Soliciting for and Receipt of Cash from Clients to 'Aid' Benefit Application Processing,ARM Pensions›Operations›Benefit Administration,4/14/2016 11:33,5/6/2016 13:23,3/3/2016,3/3/2016,₦0.00,0,N/A,0,0,0,Closed,Oluwaseun Adewale,Internal Fraud›Theft and Fraud (Internal)›Bribes/Kickbacks,Layi Afolabi,People›Motivation›Corruption / Criminal intent,"People›Motivation›Inadequate staff compensation (basic salaries, bonuses, reward-system for vigilance etc)",,,,"Increased reputational damage, as the firm may be perceived as a bribe taken firm where performance of service is dependent on the size of ""facilitation"" received.",Actual Loss,Reputational Loss,0,,,,,,Reprimand affected staff| Communication to all staff on the need to comply with staff manual policies ,Akintayo Akinola| Corona Sonuga-Oye,2016-04-30| 2016-03-30,,Complete| Complete,,,,
